{
  "schema_version": "2.0.0",
  "updated_at": "2026-08-30T14:04:21.970071+00:00",
  "source": "TSE DivulgaCandContas REST API + CDN Resultados",
  "source_url": "https://divulgacandcontas.tse.jus.br",
  "disclaimer_pt": "Dados históricos de eleições anteriores (2022). Registro oficial das candidaturas 2026 estará disponível após o TSE abrir o período.",
  "disclaimer_en": "Historical data from previous elections (2022). Official 2026 candidacy registration will be available after TSE opens the filing period.",
  "national_results_2022": {
    "election": "Presidente da República — 1.º Turno (2022-10-02)",
    "election_id": 544,
    "total_candidates": 0,
    "candidates": []
  },
  "candidates": {
    "lula": {
      "slug": "lula",
      "full_name": "Luiz Inácio Lula da Silva",
      "presidential_2022": {
        "nome_urna": "LULA",
        "numero": 13,
        "partido": "PT",
        "first_round_pct": "48.43",
        "second_round_pct": "50.90",
        "eleito": true
      },
      "state_results_2022": {},
      "collected_at": "2026-08-30T14:04:21.970071+00:00",
      "source": "TSE DivulgaCandContas / CDN Resultados",
      "source_url": "https://divulgacandcontas.tse.jus.br",
      "photo_url": "/eleicoes-2026-monitor/images/candidates/lula.jpg",
      "declared_assets": null,
      "ficha_limpa_status": null,
      "tse_registration_url": null,
      "sq_candidato": null,
      "no_2022_race": true
    },
    "flavio-bolsonaro": {
      "slug": "flavio-bolsonaro",
      "full_name": "Flávio Nantes Bolsonaro",
      "presidential_2022": null,
      "state_results_2022": {},
      "collected_at": "2026-08-30T14:04:21.970071+00:00",
      "source": "TSE DivulgaCandContas / CDN Resultados",
      "source_url": "https://divulgacandcontas.tse.jus.br",
      "photo_url": "/eleicoes-2026-monitor/images/candidates/flavio-bolsonaro.jpg",
      "declared_assets": null,
      "ficha_limpa_status": null,
      "tse_registration_url": null,
      "sq_candidato": null,
      "no_2022_race": true
    },
    "tarcisio": {
      "slug": "tarcisio",
      "full_name": "Tarcísio Gomes de Freitas",
      "presidential_2022": null,
      "state_results_2022": {},
      "collected_at": "2026-08-30T14:04:21.970071+00:00",
      "source": "TSE DivulgaCandContas / CDN Resultados",
      "source_url": "https://divulgacandcontas.tse.jus.br",
      "photo_url": "/eleicoes-2026-monitor/images/candidates/tarcisio.jpg",
      "declared_assets": null,
      "ficha_limpa_status": null,
      "tse_registration_url": null,
      "sq_candidato": null,
      "no_2022_race": true
    },
    "caiado": {
      "slug": "caiado",
      "full_name": "Ronaldo Ramos Caiado",
      "presidential_2022": null,
      "state_results_2022": {},
      "collected_at": "2026-08-30T14:04:21.970071+00:00",
      "source": "TSE DivulgaCandContas / CDN Resultados",
      "source_url": "https://divulgacandcontas.tse.jus.br",
      "photo_url": "/eleicoes-2026-monitor/images/candidates/caiado.jpg",
      "declared_assets": null,
      "ficha_limpa_status": null,
      "tse_registration_url": null,
      "sq_candidato": null,
      "no_2022_race": true
    },
    "zema": {
      "slug": "zema",
      "full_name": "Romeu Zema Neto",
      "presidential_2022": null,
      "state_results_2022": {},
      "collected_at": "2026-08-30T14:04:21.970071+00:00",
      "source": "TSE DivulgaCandContas / CDN Resultados",
      "source_url": "https://divulgacandcontas.tse.jus.br",
      "photo_url": "/eleicoes-2026-monitor/images/candidates/zema.jpg",
      "declared_assets": null,
      "ficha_limpa_status": null,
      "tse_registration_url": null,
      "sq_candidato": null,
      "no_2022_race": true
    },
    "ratinho-jr": {
      "slug": "ratinho-jr",
      "full_name": "Carlos Roberto Massa Júnior",
      "presidential_2022": null,
      "state_results_2022": {},
      "collected_at": "2026-08-30T14:04:21.970071+00:00",
      "source": "TSE DivulgaCandContas / CDN Resultados",
      "source_url": "https://divulgacandcontas.tse.jus.br",
      "photo_url": "/eleicoes-2026-monitor/images/candidates/ratinho-jr.jpg",
      "declared_assets": null,
      "ficha_limpa_status": null,
      "tse_registration_url": null,
      "sq_candidato": null,
      "no_2022_race": true
    },
    "eduardo-leite": {
      "slug": "eduardo-leite",
      "full_name": "Eduardo Figueiredo Cavalheiro Leite",
      "presidential_2022": null,
      "state_results_2022": {},
      "collected_at": "2026-08-30T14:04:21.970071+00:00",
      "source": "TSE DivulgaCandContas / CDN Resultados",
      "source_url": "https://divulgacandcontas.tse.jus.br",
      "photo_url": "/eleicoes-2026-monitor/images/candidates/eduardo-leite.jpg",
      "declared_assets": null,
      "ficha_limpa_status": null,
      "tse_registration_url": null,
      "sq_candidato": null,
      "no_2022_race": true
    },
    "aldo-rebelo": {
      "slug": "aldo-rebelo",
      "full_name": "José Aldo Rebelo Figueiredo",
      "presidential_2022": null,
      "state_results_2022": {},
      "collected_at": "2026-08-30T14:04:21.970071+00:00",
      "source": "TSE DivulgaCandContas / CDN Resultados",
      "source_url": "https://divulgacandcontas.tse.jus.br",
      "photo_url": "/eleicoes-2026-monitor/images/candidates/aldo-rebelo.jpg",
      "declared_assets": null,
      "ficha_limpa_status": null,
      "tse_registration_url": null,
      "sq_candidato": null,
      "no_2022_race": true
    },
    "renan-santos": {
      "slug": "renan-santos",
      "full_name": "Renan Franco Santos",
      "presidential_2022": null,
      "state_results_2022": {},
      "collected_at": "2026-08-30T14:04:21.970071+00:00",
      "source": "TSE DivulgaCandContas / CDN Resultados",
      "source_url": "https://divulgacandcontas.tse.jus.br",
      "photo_url": "/eleicoes-2026-monitor/images/candidates/renan-santos.jpg",
      "declared_assets": null,
      "ficha_limpa_status": null,
      "tse_registration_url": null,
      "sq_candidato": null,
      "no_2022_race": true
    }
  }
}